{
  "incident_id": "incident-example",
  "run_id": "run-example",
  "card_id": "catalog_pool_leak",
  "outcome": "unresolved",
  "counted_recovery_success": false,
  "detected_at": "2026-09-10T13:42:05Z",
  "closed_at": "2026-09-10T13:45:00Z",
  "durations": {
    "inject_to_detect_secs": null,
    "detect_to_close_secs": null,
    "approve_to_verified_secs": null
  },
  "root_cause": {
    "node": "catalog",
    "mechanism": "connection pool exhausted",
    "summary_zh": "catalog 的資料庫連線池耗盡。"
  },
  "confidence": 0.5,
  "audit": { "status": "failed", "timeline_status": "rejected", "checks": [] },
  "ai_timeline": {
    "onset": { "node": "catalog", "t": -135, "signal": "sat", "evidence_id": "ev-0001" },
    "propagation": []
  },
  "measured": { "deviations": [] },
  "comparison": {
    "ai_onset_minus_truth_secs": null,
    "ai_onset_minus_measured_secs": null,
    "detect_minus_truth_secs": null,
    "detect_minus_ai_onset_secs": null
  },
  "early_sign": null,
  "action": null,
  "verification": { "windows": [], "safety_recovery": false },
  "residual": [],
  "pinned_window": { "from_t": -600, "to_t": 0, "step_secs": 5, "count": 121 }
}
